all_awardings,associated_award,author,author_flair_background_color,author_flair_css_class,author_flair_richtext,author_flair_template_id,author_flair_text,author_flair_text_color,author_flair_type,author_fullname,author_patreon_flair,author_premium,awarders,body,collapsed_because_crowd_control,comment_type,created_utc,gildings,id,is_submitter,link_id,locked,no_follow,parent_id,permalink,retrieved_on,score,send_replies,stickied,subreddit,subreddit_id,top_awarded_type,total_awards_received,treatment_tags
[],,theflippityflip,,,[],,,,text,t2_5f7mvl4i,False,False,[],Can we just dismiss Roy Moore already?,,,1608168946,{},gg3fges,False,t3_keck0w,False,True,t3_keck0w,/r/PoliticalHumor/comments/keck0w/court_dismisses_roy_moore_covid_mask_lawsuit/gg3fges/,1608180765,2,True,False,PoliticalHumor,t5_2qm21,,0,[]
[],,Laxberry,,,[],,,,text,t2_feyuu,False,False,[],There needs to be a new template without this guy. I hate seeing this smug bastard spread around. Crowder is trash,,,1608168925,{},gg3ff2b,False,t3_kefvj7,False,False,t3_kefvj7,/r/PoliticalHumor/comments/kefvj7/achoo/gg3ff2b/,1608180741,0,True,False,PoliticalHumor,t5_2qm21,,0,[]
[],,MeraWann2a,,,[],,,,text,t2_yfyzz,False,True,[],Pretty sure that was just bruising from some kind of iv infusion treatment.  Maybe prophylactic antibody serum since “we want them infected” is their strategy to boost their insider trading on covid stocks.,,,1608168921,{},gg3fes4,True,t3_kelv5u,False,True,t1_gg3f933,/r/PoliticalHumor/comments/kelv5u/tfw_you_gotta_wait_for_your_boss_to_go_first/gg3fes4/,1608180735,2,True,False,PoliticalHumor,t5_2qm21,,0,[]
[],,theBigOist,,,[],,,,text,t2_2gbchawd,False,False,[],[here's something to listen to until those people are gone](https://youtu.be/kSQ8tZ35t4U),,,1608168884,{},gg3fc9v,False,t3_ke7gwi,False,True,t1_gg1f32r,/r/PoliticalHumor/comments/ke7gwi/what_a_wonderful_difference_dr_bidden_will_make/gg3fc9v/,1608180691,1,True,False,PoliticalHumor,t5_2qm21,,0,[]
[],,FinancialTea4,,,[],,,,text,t2_6jxampok,False,True,[],This is funny because he really didn't win in 2016 and was given the office because rural Americans are special snowflakes who need special considerations for them and them alone.,,,1608168880,{},gg3fc1k,False,t3_kemyij,False,False,t3_kemyij,/r/PoliticalHumor/comments/kemyij/trump_logic/gg3fc1k/,1608180686,18,True,False,PoliticalHumor,t5_2qm21,,0,[]
[],,MajorBensonWPayne,,,[],,,,text,t2_7pnhncd5,False,False,[],The Russian mob.,,,1608168878,{},gg3fbvu,False,t3_kelv5u,False,False,t1_gg3f933,/r/PoliticalHumor/comments/kelv5u/tfw_you_gotta_wait_for_your_boss_to_go_first/gg3fbvu/,1608180683,7,True,False,PoliticalHumor,t5_2qm21,,0,[]
[],,Nymaz,,,[],,,,text,t2_67t8o,False,False,[],Halloween 2021,,,1608168862,{},gg3fau8,False,t3_kecztt,False,True,t3_kecztt,/r/PoliticalHumor/comments/kecztt/he_should_do_it_for_laughs/gg3fau8/,1608180665,1,True,False,PoliticalHumor,t5_2qm21,,0,[]
[],,stokysloky,,,[],,,,text,t2_6dohzf30,False,False,[],I wish I could upvote this comment twice,,,1608168838,{},gg3f9al,False,t3_ke7gwi,False,True,t1_gg1q975,/r/PoliticalHumor/comments/ke7gwi/what_a_wonderful_difference_dr_bidden_will_make/gg3f9al/,1608180638,2,True,False,PoliticalHumor,t5_2qm21,,0,[]
[],,93n1ss,,,[],,,,text,t2_3qvpoazy,False,False,[],"Hey man, if you're here to troll posters and creators that's ok. Humor is in the name of the sub. 

Just admit to being a troll so people can troll back. It's healthier for the community.",,,1608168837,{},gg3f98z,False,t3_kem2ee,False,True,t1_gg3btln,/r/PoliticalHumor/comments/kem2ee/when_they_cant_explain_their_point_of_view/gg3f98z/,1608180638,0,True,False,PoliticalHumor,t5_2qm21,,0,[]
[],,calloy,,,[],,,,text,t2_6d9a4rfp,False,False,[],I still want to know who beat him up a few weeks ago.,,,1608168835,{},gg3f933,False,t3_kelv5u,False,True,t3_kelv5u,/r/PoliticalHumor/comments/kelv5u/tfw_you_gotta_wait_for_your_boss_to_go_first/gg3f933/,1608180634,3,True,False,PoliticalHumor,t5_2qm21,,0,[]
